{
  "$schema": "https://json-schema.org/draft/2020-12/schema",
  "$id": "https://agentflow.dev/schemas/sdlc-config.schema.json",
  "title": "AgentFlow SDLC configuration",
  "type": "object",
  "required": ["version", "authority", "paths", "labels", "release", "gateways", "extensionPolicy"],
  "properties": {
    "version": {
      "type": "integer",
      "const": 1
    },
    "authority": {
      "type": "object",
      "required": ["human", "machine"],
      "properties": {
        "human": {
          "type": "string"
        },
        "machine": {
          "type": "string"
        },
        "executionAdapter": {
          "type": "string"
        }
      },
      "additionalProperties": false
    },
    "principles": {
      "type": "array",
      "items": {
        "type": "string"
      }
    },
    "vocabulary": {
      "type": "object",
      "properties": {
        "rolePassStatuses": {
          "$ref": "#/$defs/nonEmptyStringArray"
        },
        "artifactKinds": {
          "$ref": "#/$defs/nonEmptyStringArray"
        },
        "sourceAuthorities": {
          "$ref": "#/$defs/nonEmptyStringArray"
        },
        "artifactRelationships": {
          "$ref": "#/$defs/nonEmptyStringArray"
        },
        "actionBoundaries": {
          "$ref": "#/$defs/nonEmptyStringArray"
        }
      },
      "additionalProperties": false
    },
    "roles": {
      "type": "array",
      "minItems": 1,
      "items": {
        "type": "object",
        "required": ["phase", "slug", "label", "owns"],
        "properties": {
          "phase": {
            "type": "integer",
            "minimum": 0
          },
          "slug": {
            "type": "string",
            "pattern": "^[a-z0-9]+(?:-[a-z0-9]+)*$"
          },
          "label": {
            "type": "string"
          },
          "owns": {
            "type": "array",
            "items": {
              "type": "string"
            }
          }
        },
        "additionalProperties": true
      }
    },
    "paths": {
      "type": "object",
      "minProperties": 1,
      "additionalProperties": {
        "type": "object",
        "required": ["requiredRoles", "optionalRoles", "allowsSelfReview", "requiresHumanApproval"],
        "properties": {
          "requiredRoles": {
            "type": "array",
            "items": {
              "type": "string"
            }
          },
          "optionalRoles": {
            "type": "array",
            "items": {
              "type": "string"
            }
          },
          "allowsSelfReview": {
            "type": "boolean"
          },
          "requiresHumanApproval": {
            "type": "boolean"
          }
        },
        "additionalProperties": true
      }
    },
    "transitions": {
      "type": "array",
      "items": {
        "type": "array",
        "minItems": 2,
        "maxItems": 2,
        "items": {
          "type": "string"
        }
      }
    },
    "labels": {
      "type": "object"
    },
    "release": {
      "type": "object"
    },
    "gateways": {
      "type": "object"
    },
    "actionPolicy": {
      "type": "object",
      "properties": {
        "profileMaximums": {
          "type": "object",
          "additionalProperties": {
            "type": "string"
          }
        },
        "externalActionRequiresHumanApproval": {
          "type": "boolean"
        },
        "delegationMayNotWidenBoundary": {
          "type": "boolean"
        }
      },
      "additionalProperties": false
    },
    "extensionPolicy": {
      "type": "object"
    },
    "deliveryPolicy": {
      "type": "object",
      "properties": {
        "contractVersion": {
          "const": 2
        },
        "deterministicOrigins": {
          "type": "array",
          "minItems": 1,
          "uniqueItems": true,
          "items": {
            "enum": ["collector-observed", "external-resolved"]
          }
        },
        "sourceAcknowledgmentRequired": {
          "const": true
        },
        "unknownWriterBlocksRecovery": {
          "const": true
        },
        "admissionBudgetRejectsUnknownUsage": {
          "const": true
        },
        "requiredJourneyCoverage": {
          "type": "boolean"
        },
        "budgetMaxima": {
          "type": "object",
          "maxProperties": 1,
          "additionalProperties": {
            "type": "number",
            "minimum": 0
          }
        },
        "oracleAssurance": {
          "type": "object",
          "required": ["required"],
          "properties": {
            "required": {
              "type": "boolean"
            }
          },
          "additionalProperties": false
        }
      },
      "additionalProperties": false
    }
  },
  "additionalProperties": true,
  "$defs": {
    "nonEmptyStringArray": {
      "type": "array",
      "minItems": 1,
      "uniqueItems": true,
      "items": {
        "type": "string",
        "minLength": 1
      }
    }
  }
}
